<?xml version="1.0" encoding="UTF-8"?>

<!ELEMENT Root (Child+)>
<!ELEMENT Child (name,id,address)>
<!ELEMENT name (#PCDATA)>
<!ELEMENT id (#PCDATA)>
<!ELEMENT address (#PCDATA)>
<!ATTLIST Child aid ID #REQUIRED>
